{"$defs":{"observable_file":{"additionalProperties":false,"properties":{"digest":{"pattern":"^sha256:[a-f0-9]{64}$","type":"string"},"path":{"minLength":1,"type":"string"}},"required":["path","digest"],"type":"object"}},"$schema":"https://json-schema.org/draft/2020-12/schema","additionalProperties":false,"properties":{"attestations":{"items":{"additionalProperties":false,"properties":{"attestation_type":{"enum":["run_provenance","signature"],"type":"string"},"signature":{"type":"string"},"signer":{"minLength":1,"type":"string"},"statement_digest":{"pattern":"^sha256:[a-f0-9]{64}$","type":"string"},"timestamp":{"format":"date-time","type":"string"}},"required":["attestation_type","signer","statement_digest","timestamp"],"type":"object"},"minItems":1,"type":"array"},"bundle_digest":{"pattern":"^sha256:[a-f0-9]{64}$","type":"string"},"created_at":{"format":"date-time","type":"string"},"environment_info":{"additionalProperties":false,"properties":{"cuda_version":{"minLength":1,"type":"string"},"driver_version":{"minLength":1,"type":"string"},"gpu_inventory":{"items":{"minLength":1,"type":"string"},"minItems":1,"type":"array"},"hardware_fingerprint":{"pattern":"^sha256:[a-f0-9]{64}$","type":"string"},"torch_version":{"minLength":1,"type":"string"},"vllm_version":{"minLength":1,"type":"string"}},"required":["vllm_version","torch_version","cuda_version","driver_version","gpu_inventory","hardware_fingerprint"],"type":"object"},"execution_context":{"additionalProperties":false,"properties":{"argv":{"items":{"minLength":1,"type":"string"},"minItems":1,"type":"array"},"cwd":{"minLength":1,"type":"string"},"entrypoint":{"minLength":1,"type":"string"},"input_mounts":{"additionalProperties":false,"properties":{"lockfile_path":{"minLength":1,"type":"string"},"manifest_path":{"minLength":1,"type":"string"},"runtime_closure_path":{"minLength":1,"type":"string"}},"required":["manifest_path","lockfile_path","runtime_closure_path"],"type":"object"},"pod":{"additionalProperties":false,"properties":{"name":{"minLength":1,"type":"string"},"namespace":{"minLength":1,"type":"string"},"node_name":{"minLength":1,"type":"string"}},"required":["name","node_name","namespace"],"type":"object"},"replica_id":{"minLength":1,"type":"string"}},"required":["entrypoint","argv","cwd","replica_id","pod","input_mounts"],"type":"object"},"execution_trace_metadata":{"additionalProperties":false,"properties":{"resolved_args":{"additionalProperties":{"type":"string"},"type":"object"},"resolved_env":{"additionalProperties":{"type":"string"},"type":"object"}},"required":["resolved_args","resolved_env"],"type":"object"},"hardware_conformance":{"additionalProperties":false,"properties":{"actual_fingerprint":{"pattern":"^sha256:[a-f0-9]{64}$","type":"string"},"diffs":{"items":{"additionalProperties":false,"properties":{"actual":{"type":"string"},"expected":{"type":"string"},"path":{"minLength":1,"type":"string"}},"required":["path","expected","actual"],"type":"object"},"type":"array"},"expected_fingerprint":{"pattern":"^sha256:[a-f0-9]{64}$","type":"string"},"status":{"enum":["conformant","non_conformant"],"type":"string"},"strict_hardware":{"type":"boolean"}},"required":["status","strict_hardware","expected_fingerprint","actual_fingerprint","diffs"],"type":"object"},"hardware_probe":{"additionalProperties":false,"properties":{"evidence":{"items":{"minLength":1,"type":"string"},"minItems":1,"type":"array"},"source":{"enum":["runtime_hardware_file","env_probe","nvidia_smi","expected_profile_fallback"],"type":"string"}},"required":["source","evidence"],"type":"object"},"lockfile_copy":{"additionalProperties":false,"properties":{"digest":{"pattern":"^sha256:[a-f0-9]{64}$","type":"string"},"path":{"minLength":1,"type":"string"}},"required":["path","digest"],"type":"object"},"manifest_copy":{"additionalProperties":false,"properties":{"digest":{"pattern":"^sha256:[a-f0-9]{64}$","type":"string"},"path":{"minLength":1,"type":"string"}},"required":["path","digest"],"type":"object"},"network_provenance":{"additionalProperties":false,"properties":{"capture_digest":{"pattern":"^sha256:[a-f0-9]{64}$","type":"string"},"capture_isolation":{"enum":["pre_enqueue_mirror"],"type":"string"},"capture_mode":{"enum":["userspace_pre_enqueue"],"type":"string"},"capture_non_perturbing":{"type":"boolean"},"capture_path":{"minLength":1,"type":"string"},"frame_count":{"minimum":0,"type":"integer"},"route_mode":{"enum":["deterministic_userspace_stack"],"type":"string"}},"required":["capture_path","capture_digest","frame_count","capture_mode","capture_isolation","capture_non_perturbing","route_mode"],"type":"object"},"observables":{"additionalProperties":false,"properties":{"logits":{"$ref":"#/$defs/observable_file"},"network_egress":{"additionalProperties":false,"properties":{"digest":{"pattern":"^sha256:[a-f0-9]{64}$","type":"string"},"path":{"minLength":1,"type":"string"}},"required":["path","digest"],"type":"object"},"tokens":{"$ref":"#/$defs/observable_file"}},"required":["tokens","logits","network_egress"],"type":"object"},"rerun_metadata":{"additionalProperties":false,"properties":{"argv":{"items":{"minLength":1,"type":"string"},"minItems":1,"type":"array"},"artifact_count":{"minimum":1,"type":"integer"},"attestation_digests":{"items":{"pattern":"^sha256:[a-f0-9]{64}$","type":"string"},"minItems":1,"type":"array"},"entrypoint":{"minLength":1,"type":"string"},"lockfile_digest":{"pattern":"^sha256:[a-f0-9]{64}$","type":"string"},"manifest_digest":{"pattern":"^sha256:[a-f0-9]{64}$","type":"string"},"replica_id":{"minLength":1,"type":"string"},"runtime_closure_digest":{"pattern":"^sha256:[a-f0-9]{64}$","type":"string"}},"required":["entrypoint","argv","replica_id","manifest_digest","lockfile_digest","runtime_closure_digest","artifact_count","attestation_digests"],"type":"object"},"resolved_artifact_digests":{"items":{"additionalProperties":false,"properties":{"artifact_id":{"pattern":"^[A-Za-z0-9._:-]+$","type":"string"},"artifact_type":{"type":"string"},"digest":{"pattern":"^sha256:[a-f0-9]{64}$","type":"string"}},"required":["artifact_id","artifact_type","digest"],"type":"object"},"minItems":1,"type":"array"},"run_bundle_version":{"const":"v1","type":"string"},"run_id":{"pattern":"^[A-Za-z0-9][A-Za-z0-9._-]{2,127}$","type":"string"},"runtime_closure_digest":{"pattern":"^sha256:[a-f0-9]{64}$","type":"string"}},"required":["run_bundle_version","run_id","created_at","manifest_copy","lockfile_copy","runtime_closure_digest","resolved_artifact_digests","environment_info","execution_trace_metadata","observables","attestations","bundle_digest","hardware_probe","hardware_conformance","execution_context","rerun_metadata","network_provenance"],"title":"run_bundle.v1","type":"object"}
