{"attestations":[{"attestation_type":"run_provenance","signer":"runner@deterministic-serving-stack","statement_digest":"sha256:4407b7f0f7ec33591a6e64f74852a311ee5e7cc351cf283e70f6509d1293e1fc","timestamp":"2026-04-08T14:12:45Z"}],"bundle_digest":"sha256:8813a46cef9d108f680801335a8f79d38ca2356158ef21ae91276d3a86fb3ee1","created_at":"2026-04-08T14:12:45Z","environment_info":{"cuda_version":"12.8","driver_version":"565.77","gpu_inventory":["NVIDIA GeForce RTX 4090","NVIDIA GeForce RTX 4090","NVIDIA GeForce RTX 4090","NVIDIA GeForce RTX 4090"],"hardware_fingerprint":"sha256:5e3defd88bd507c5eb34c4de615ec834d0d9eb8e262a25559a73c050bf43d965","torch_version":"2.10.0+cu128","vllm_version":"0.19.0"},"execution_context":{"argv":["/workspace/deterministic_serving_stack/cmd/runner/main.py","--manifest","manifests/qwen2.5-32b-tp4.manifest.json","--lockfile","/tmp/tp4-built.lock.json","--out-dir","/tmp/tp4-run-b","--mode","vllm","--replica-id","replica-0"],"cwd":"/workspace/deterministic_serving_stack","entrypoint":"/workspace/deterministic_serving_stack/cmd/runner/main.py","input_mounts":{"lockfile_path":"/tmp/tp4-built.lock.json","manifest_path":"manifests/qwen2.5-32b-tp4.manifest.json","runtime_closure_path":"lockfile.runtime_closure_digest"},"pod":{"name":"local-pod","namespace":"default","node_name":"local-node"},"replica_id":"replica-0"},"execution_trace_metadata":{"resolved_args":{"replica_id":"replica-0","strict_hardware":"false"},"resolved_env":{}},"hardware_conformance":{"actual_fingerprint":"sha256:5e3defd88bd507c5eb34c4de615ec834d0d9eb8e262a25559a73c050bf43d965","diffs":[],"expected_fingerprint":"sha256:5e3defd88bd507c5eb34c4de615ec834d0d9eb8e262a25559a73c050bf43d965","status":"conformant","strict_hardware":false},"hardware_probe":{"evidence":["Host probe disabled or unavailable; using manifest hardware_profile"],"source":"expected_profile_fallback"},"lockfile_copy":{"digest":"sha256:516ca2b29744f9712a8059db864b91e473168c097dea7bf666d336dcf6b1563b","path":"lockfile.json"},"manifest_copy":{"digest":"sha256:ae7652b5d72310cd59f357fffff28bfc7e97b9f88f4b906bf6a5775ecfb62f0d","path":"manifest.json"},"network_provenance":{"capture_digest":"sha256:a4d876d43c1f335ae5c77414d5cea9e9bdb8079f33669dbb242dc018f028de13","capture_isolation":"pre_enqueue_mirror","capture_mode":"userspace_pre_enqueue","capture_non_perturbing":true,"capture_path":"observables/network_egress.json","frame_count":4,"route_mode":"deterministic_userspace_stack"},"observables":{"logits":{"digest":"sha256:aee5a2be7f7e96bb685c972760bc40023c0e6c0feba1abfca9c95373d762048c","path":"observables/logits.json"},"network_egress":{"digest":"sha256:2f52b7cfc26e260acfffd0d774e3f5aa797ef503a0ce9de6828434db40098a21","path":"observables/network_egress.json"},"tokens":{"digest":"sha256:f45651eea25b8c52f18d74422c3b12b0666496fa17a03a2a6d89066360ebe389","path":"observables/tokens.json"}},"rerun_metadata":{"argv":["/workspace/deterministic_serving_stack/cmd/runner/main.py","--manifest","manifests/qwen2.5-32b-tp4.manifest.json","--lockfile","/tmp/tp4-built.lock.json","--out-dir","/tmp/tp4-run-b","--mode","vllm","--replica-id","replica-0"],"artifact_count":28,"attestation_digests":["sha256:c6cdaf7e20c223e68d49b838f7a3ebae7f5800aa1b27163dcc015ada3336176a","sha256:4ee25e4dce791802f6769102a19a1352c23c62ca04b724b61d25e4f096c1089e"],"entrypoint":"/workspace/deterministic_serving_stack/cmd/runner/main.py","lockfile_digest":"sha256:b175a0624cce1fb45a2a310e1718c153e5c6cda8e31c79eefd5bb3ffd32519f8","manifest_digest":"sha256:ae7652b5d72310cd59f357fffff28bfc7e97b9f88f4b906bf6a5775ecfb62f0d","replica_id":"replica-0","runtime_closure_digest":"sha256:3bfb14e6223c0bd5695a456f7adb6e5820b4d54c7541178dc7577247e48ddd52"},"resolved_artifact_digests":[{"artifact_id":"hf-chat_template-tokenizer_config.json","artifact_type":"chat_template","digest":"sha256:54b75a01d000209483600a5e411bb9ebc7234b5600324cdbea9f61646255e3a0"},{"artifact_id":"compiled-ext","artifact_type":"compiled_extension","digest":"sha256:abababababababababababababababababababababababababababababababab"},{"artifact_id":"cuda-lib","artifact_type":"cuda_lib","digest":"sha256:2222222222222222222222222222222222222222222222222222222222222222"},{"artifact_id":"hf-generation_config-generation_config.json","artifact_type":"generation_config","digest":"sha256:d7ebe7f96729d35a43ae5ac059dfda31a7ea38c3614602e79253d18344dae928"},{"artifact_id":"kernel-lib","artifact_type":"kernel_library","digest":"sha256:3333333333333333333333333333333333333333333333333333333333333333"},{"artifact_id":"hf-config-config.json","artifact_type":"model_config","digest":"sha256:293f72ff484ab39d5e40dabf8c5937c864606deff36270db333f8a3a129937bd"},{"artifact_id":"hf-weights_shard-model-00001-of-00017.safetensors","artifact_type":"model_weights","digest":"sha256:c569737aa83e2e4fcc6a1ca9d33941008bc9e7571cb5816646bbb57a17ecaf62"},{"artifact_id":"hf-weights_shard-model-00002-of-00017.safetensors","artifact_type":"model_weights","digest":"sha256:cc884500edb17d9eda00ce41ba97775f1f0ab3bbf33d17256f8c647cdb4be952"},{"artifact_id":"hf-weights_shard-model-00003-of-00017.safetensors","artifact_type":"model_weights","digest":"sha256:e03d773a356510d40d38f25d1d36179feeff7b14a92dea3e11913820d9a37b9c"},{"artifact_id":"hf-weights_shard-model-00004-of-00017.safetensors","artifact_type":"model_weights","digest":"sha256:fa15074d9d26f4a9fb98e63bd3e1ca3437ca0e3de016d815c548341b9561ea45"},{"artifact_id":"hf-weights_shard-model-00005-of-00017.safetensors","artifact_type":"model_weights","digest":"sha256:b0a022b584cab2278b488c5ed49e7e12cbd79ef4a6bf108fc22df056fae2e79d"},{"artifact_id":"hf-weights_shard-model-00006-of-00017.safetensors","artifact_type":"model_weights","digest":"sha256:a18d92eb21c30e887ec52d6105094607b393e56adace973470877cc5ffa14f14"},{"artifact_id":"hf-weights_shard-model-00007-of-00017.safetensors","artifact_type":"model_weights","digest":"sha256:810803fe0312a192fedb8f2028143357df963149ba2a430b971b6c10f7606b50"},{"artifact_id":"hf-weights_shard-model-00008-of-00017.safetensors","artifact_type":"model_weights","digest":"sha256:b896e75cb3b4d2cee8bf1de2ffb52e41d706afc597a8f7d83c5b1682e6b8c003"},{"artifact_id":"hf-weights_shard-model-00009-of-00017.safetensors","artifact_type":"model_weights","digest":"sha256:273fc11a86b09ae342c9beb6441022b2a4c60333305332d21b6e894460c0bd2b"},{"artifact_id":"hf-weights_shard-model-00010-of-00017.safetensors","artifact_type":"model_weights","digest":"sha256:39d890c08b9200ce0001e7cefd9367f65662675432fccc08def619b96659714e"},{"artifact_id":"hf-weights_shard-model-00011-of-00017.safetensors","artifact_type":"model_weights","digest":"sha256:054170d4fb6f0b2c2a4522c092d3fe382294db4676250be2c1d2c03acf269fa6"},{"artifact_id":"hf-weights_shard-model-00012-of-00017.safetensors","artifact_type":"model_weights","digest":"sha256:866a2697d65ccf7c55e885433fd43e210ea05df7f6f557b016a536f26eed84ac"},{"artifact_id":"hf-weights_shard-model-00013-of-00017.safetensors","artifact_type":"model_weights","digest":"sha256:b013155496808ff156c3a41e0bfa30608213d1f627d14703ef84fac04e0c2412"},{"artifact_id":"hf-weights_shard-model-00014-of-00017.safetensors","artifact_type":"model_weights","digest":"sha256:3a71915970636dc19252e7c31229cf8747234bc9c3c79e0470154f43d519fb80"},{"artifact_id":"hf-weights_shard-model-00015-of-00017.safetensors","artifact_type":"model_weights","digest":"sha256:88d5f13f8ebcfcb447bde163addab2032a5b9d6335a1d0194728e56990cfe077"},{"artifact_id":"hf-weights_shard-model-00016-of-00017.safetensors","artifact_type":"model_weights","digest":"sha256:f99af3960f7f2fa195b40ccb1b5851be08c4191cacd64e1fb8bcf5e818160f25"},{"artifact_id":"hf-weights_shard-model-00017-of-00017.safetensors","artifact_type":"model_weights","digest":"sha256:8af67ca1cd45025ca8311da7972e83a6975c6ad7d936863b51278cdf6d25782e"},{"artifact_id":"hf-prompt_formatter-tokenizer_config.json","artifact_type":"prompt_formatter","digest":"sha256:d37bd980f049f89e2d5cd1d7e89417b408160af65718f07353767ba049d9e4c6"},{"artifact_id":"request-set","artifact_type":"request_set","digest":"sha256:7777777777777777777777777777777777777777777777777777777777777777"},{"artifact_id":"runtime-knobs","artifact_type":"runtime_knob_set","digest":"sha256:6666666666666666666666666666666666666666666666666666666666666666"},{"artifact_id":"serving-stack","artifact_type":"serving_stack","digest":"sha256:1111111111111111111111111111111111111111111111111111111111111111"},{"artifact_id":"hf-tokenizer-tokenizer.json","artifact_type":"tokenizer","digest":"sha256:55be38cbda7488db73f671e2343df4d0fcfdcb6b71c5ba5ce0158296f7a82009"}],"run_bundle_version":"v1","run_id":"qwen2.5-32b-tp4-det-001","runtime_closure_digest":"sha256:3bfb14e6223c0bd5695a456f7adb6e5820b4d54c7541178dc7577247e48ddd52"}
